{
  "scenario_id": "rear_end_003",
  "category": "rear_end",
  "scenario_text": "Am 5. November 2024 gegen 06:45 Uhr ereignete sich auf der L1100 ein Auffahrunfall bei Nebel. Fahrzeug A (Audi A4) fuhr mit ca. 70 km/h, obwohl die Sichtweite nur ca. 50 Meter betrug. Fahrzeug B (Ford Focus) stand an einer roten Ampel. Der Fahrer von A erkannte Fahrzeug B zu spät und konnte trotz Notbremsung eine Kollision nicht vermeiden. Die Aufprallgeschwindigkeit lag bei ca. 40 km/h. Die Fahrbahn war nass. Bei der Unfallaufnahme stellte die Polizei fest, dass die Bremsen von Fahrzeug A in schlechtem Zustand waren. Fahrzeug A erlitt Totalschaden.",
  "metadata": {
    "location_type": "suburban",
    "weather": "fog",
    "time_of_day": "morning",
    "road_type": "landstrasse",
    "vehicles_involved": 2
  },
  "ground_truth": {
    "primary_cause": "Bremsversagen bei nicht angepasster Geschwindigkeit",
    "primary_cause_taxonomy_id": "brake_failure",
    "accident_type": "rear_end",
    "contributing_factors": [
      {
        "factor": "Defekte Bremsanlage",
        "category": "vehicle_defect",
        "severity": "primary"
      },
      {
        "factor": "Überhöhte Geschwindigkeit bei Nebel",
        "category": "human_error",
        "severity": "secondary"
      },
      {
        "factor": "Nasse Fahrbahn verlängerte Bremsweg",
        "category": "environmental",
        "severity": "minor"
      }
    ],
    "responsibility": [
      {
        "party": "Fahrzeug A",
        "percentage": 100
      },
      {
        "party": "Fahrzeug B",
        "percentage": 0
      }
    ],
    "relevant_stvo": [
      "§3 StVO",
      "§23 StVO"
    ],
    "expected_claims": [
      "Die Geschwindigkeit war den Sichtverhältnissen nicht angepasst.",
      "Die Bremsanlage war mangelhaft.",
      "Die Sichtweite betrug nur ca. 50 Meter.",
      "Fahrzeug B stand bei Rot an der Ampel."
    ],
    "legal_references": [
      "§3 Abs. 1 StVO",
      "§23 StVO",
      "§7 StVG"
    ]
  }
}