{
  "scenario_id": "pedestrian_003",
  "category": "pedestrian",
  "scenario_text": "Am 29. Juli 2024 gegen 01:00 Uhr wurde ein betrunkener Fußgänger (2,1 Promille) auf der Hauptstraße von Fahrzeug A (Toyota RAV4) erfasst. Der Fußgänger überquerte die Fahrbahn bei Rot, ca. 50 Meter vom nächsten Zebrastreifen entfernt. Der Fahrer konnte trotz angepasster Geschwindigkeit (45 km/h bei erlaubten 50 km/h) nicht mehr rechtzeitig bremsen. Der Fußgänger erlitt multiple Verletzungen.",
  "metadata": {
    "location_type": "urban",
    "weather": "clear",
    "time_of_day": "night",
    "road_type": "innerorts",
    "vehicles_involved": 1
  },
  "ground_truth": {
    "primary_cause": "Alkoholisierter Fußgänger überquert Fahrbahn bei Rot",
    "primary_cause_taxonomy_id": "intoxication",
    "accident_type": "pedestrian",
    "contributing_factors": [
      {
        "factor": "Fußgänger bei Rot über Fahrbahn",
        "category": "human_error",
        "severity": "primary"
      },
      {
        "factor": "Starke Alkoholisierung des Fußgängers",
        "category": "human_error",
        "severity": "primary"
      }
    ],
    "responsibility": [
      {
        "party": "Fußgänger",
        "percentage": 75
      },
      {
        "party": "Fahrzeug A",
        "percentage": 25
      }
    ],
    "relevant_stvo": [
      "§25 StVO",
      "§37 StVO"
    ],
    "expected_claims": [
      "Der Fußgänger überquerte bei Rot.",
      "Der Fußgänger war mit 2,1 Promille stark alkoholisiert.",
      "Der Fahrer fuhr mit angepasster Geschwindigkeit.",
      "Die Betriebsgefahr des Fahrzeugs bleibt bestehen."
    ],
    "legal_references": [
      "§25 Abs. 3 StVO",
      "§7 StVG"
    ]
  }
}